name,description,link_url,image_url,manufacturer_id
SPIRAL NEST CHANDELIER,"The SPIRAL NEST Chandelier is composed of hand-rolled steel rods in various thicknesses, skillfully welded together. Inspired by a sketch in the artist's notebook, each Nest is slightly different, and although similar no two are identical. This contemporary chandelier works well in residential, hospitality, and commercial settings.",https://www.ridgelystudioworks.com/collections/all/products/spiral-nest-chandelier-1,https://www.ridgelystudioworks.com/cdn/shop/products/Spiral_Nest_Chandelier_1R_1024x1024.jpg?v=1601390777,3180
SPIRAL NEST PENDANT,"The SPIRAL NEST series is a happy accident born from a scribble in the artist’s notepad. It is composed of hand-rolled steel rods in various thicknesses skillfully welded together. Each SPIRAL NEST is slightly different and although similar, no two are identical. These nests work well as stand-alone pendants, small clusters, and cascading configurations and in larger groupings to create custom installations.

The SPIRAL NEST was awarded best in show by Interior Design Magazine at the ICFF in 2013.",https://www.ridgelystudioworks.com/collections/all/products/spiral-nest-pendant,https://www.ridgelystudioworks.com/cdn/shop/products/SN-PE-103FER-W_a84e4a59-4e00-417d-9069-5e1d85951187_1024x1024.jpg?v=1601493867,3180
STACK CHANDELIER,"(from $6,800.00 to $100,000.00)",https://www.ridgelystudioworks.com/collections/all/products/copy-of-custom-2,https://www.ridgelystudioworks.com/cdn/shop/products/STACKFlushmount2-Daylight-Copy_1024x1024.jpg?v=1675107671,3180
STACK LED CHANDELIER,"Starting with a sketch, the concept of a line drawing made of light drove the development of the Stack fixture. The Stack light’s design language creates a volumetric composition that can fill a large space without significant visual weight. The fixture retains a feeling of lightness by balancing geometric lines with negative space. The Stack light can be scaled to fit any space without compromising the form, providing unique lighting solutions for a variety of environments.",https://www.ridgelystudioworks.com/collections/all/products/stack-led-chandelier,https://www.ridgelystudioworks.com/cdn/shop/products/StackCustom-Black_1024x1024.jpg?v=1660069916,3180
STACK LED WALL SCONCE,"Produced entirely in-house, the STACK Wall Sconce utilizes modern LED technology in conjunction with brake formed steel channel to create an extremely robust product. This sconce is the perfect pairing to the STACK Chandelier.",https://www.ridgelystudioworks.com/collections/all/products/stack-led-wall-sconce,https://www.ridgelystudioworks.com/cdn/shop/products/STACK-LED-Wall-Sconce_1024x1024.jpg?v=1660071284,3180
STICK PENDANT,"The STICK Pendant is composed of artistically welded steel round rod.  Each piece is uniquely handmade and while similar, no two fixtures are exactly the same.",https://www.ridgelystudioworks.com/collections/all/products/stick-pendant,https://www.ridgelystudioworks.com/cdn/shop/products/Stick_Pendant_GlossBlack_1024x1024.jpg?v=1509118827,3180
