name,description,link_url,image_url,manufacturer_id
59″ Long Affinity Southland Island Pendant | 245501,"Affinity is a finely executed, minimalist design featuring a straight line designed frame in a Solar Black finish with a sleek Tinted Bronze Glass diffuser. Using 6 energy efficient 5-watt LED lamps, the linear pendant is perfect for illuminating conference rooms, reception areas, islands, and other spaces. The Affinity Oblong Pendant is featured in our American manufactured, American designed, handcrafted Industrial Lighting Collection. UL and cUL listed for dry and damp locations. This architectural pendant is featured at the Southland Casino in West Memphis, Arkansas.",https://2ndave.com/product/59-long-affinity-southland-island-pendant-245501/,https://2ndave.com/wp-content/uploads/2023/02/245501.jpg,1261
59″ Wide Bola 12 Light Two Tier Cascading Chandelier | 257077,"Innovation and imagination are integrated for a stunning decorative lighting look. A captivating illuminating design, this cascading chandelier displays 12 Clear Seeded Glass globes. The Bola orbs reveal customer-supplied Edison bulbs attached to hardware featured in a Solar Black finish. The chandelier is perfect for foyers, lobbies, and other spaces with tall ceilings. The Bola Chandelier is featured in our American-made, American-designed, handmade Modern Lighting Collection and manufactured in Yorkville, NY. UL & cUL listed for dry and damp locations.",https://2ndave.com/product/59-wide-bola-12-light-two-tier-cascading-chandelier-257077/,https://2ndave.com/wp-content/uploads/2023/02/257077.jpg,1261
59″ Wide Havasu 721 Light Cascading Pendant | 221345,"Colorful drama and bold excitement are defined by this energy efficient statement piece for large residential, hospitality and commercial spaces. The massive Havasu Cascading Chandelier stands 20 feet tall and is 5 feet wide. The modern, sophisticated ceiling fixture is designed and engineered with 721 Crystal Idalight rods that illuminate and change color with integral RGB LEDs. Each rod is 19.5 inches long while the hardware is featured in a luxurious Gold Metallic finish. The LEDs project powerful beams of light through the Idalight rods, creating a very unique and eye-catching ambient setting. Compatible with stage or house lighting control systems using DMX512 technology.",https://2ndave.com/product/59-wide-havasu-721-light-cascading-pendant-221345/,https://2ndave.com/wp-content/uploads/2022/12/221345.jpg,1261
59″ Wide Marquee Pendant | 130268,"Add drama and sophistication paired with distinctive lighting and quality. Marquee is a unique pendant featuring fluted Crystal Idalight that is complemented with trim and hardware offered in a Black finish. Handmade in the USA, this pendant is offered in custom sizes, styles and finishes, as well as dimmable energy efficient lamping options. UL and cUL listed for damp and dry locations.",https://2ndave.com/product/59-wide-marquee-pendant-130268/,https://2ndave.com/wp-content/uploads/2022/12/130268.jpg,1261
59″ Wide Marquee Pendant | 184035,"Add drama and sophistication paired with distinctive lighting and quality. Marquee is a unique pendant featuring fluted Crystal Idalight that is complemented with trim and hardware offered in an Oil Rubbed Bronze finish. Handmade in the USA, this fixture is offered in custom sizes, styles and finishes, as well as dimmable energy efficient lamping options such as LED. The pendant is UL and cUL listed for damp and dry locations.",https://2ndave.com/product/59-wide-marquee-pendant-184035/,https://2ndave.com/wp-content/uploads/2022/12/184035.jpg,1261
59″L Quadrato Lounge Oblong Pendant | 163750,"Casual elegance comes to light with the Quadrato Lounge lighting design. This dapper oblong pendant features Beige Burlap with Dark Brown Trim which is enhanced with a Statuario Idalight bottom diffuser. The charming shade is complemented with a frame and hardware featured in a warm Timeless Bronze finish. The fixture is ideal for illuminating billiard and dining tables, islands, counters and bars. Handmade in the USA, this pendant is available in custom sizes, styles and colors, as well as dimmable energy efficient lamping options such as LED. The fixture is UL and cUL listed for damp and dry locations.",https://2ndave.com/product/59l-quadrato-lounge-oblong-pendant-163750/,https://2ndave.com/wp-content/uploads/2022/12/163750.jpg,1261
59″W Banana Bamboo 6 LT Chandelier | 136614,no description available.,https://2ndave.com/product/59w-banana-bamboo-6-lt-chandelier-136614/,https://2ndave.com/wp-content/uploads/2022/12/136614.jpg,1261
6.25″Sq Kitzi Cylinder Mini Pendant | 125508,"A sophisticated architecturally styled fixture is designed with a pizazz that is unique, fresh and stylish. Give your decor an extra edge with this breathtaking fixture. The solid steel structure surrounds a hand-painted cylindrical diffuser in Amber Mist Art Glass and enhanced with iridescent glass accents on the top and bottom of the frame. The hardware, decorative accents and frame are featured in a handsome Bronze finish. Align this mini pendant in multiples across a bar, island, counter or table in residential, hospitality and commercial settings. Handcrafted in the USA, Kitzi is available in custom sizes, styles and finishes, as well as dimmable energy efficient lamping options such as LED. UL and CUL listed for dry and wet locations.",https://2ndave.com/product/6-25sq-kitzi-cylinder-mini-pendant-125508/,https://2ndave.com/wp-content/uploads/2023/02/125508.jpg,1261
6.25″W Kesara Wall Sconce | 118325,"A bold geometric shade with stylish hardware brings a dynamic element to this minimalist lighting design. A cube-like Beige Textrene shade is embraced by a Blackwash finished frame with hardware. Handcrafted in the USA, this handsome fixture is available in custom sizes, designs and finishes, as well as dimmable energy efficient lamping options such as LED. The 31-inch tall luminaire is UL and cUL listed for dry and damp locations.",https://2ndave.com/product/6-25w-kesara-wall-sconce-118325/,https://2ndave.com/wp-content/uploads/2022/12/118325.jpg,1261
6.5-13.5″W Whitley Swing Arm Wall Sconce | 150471,"This item is custom made. If you like it, Please call for a quote and lead time.",https://2ndave.com/product/6-5-13-5w-whitley-swing-arm-wall-sconce-150471/,https://2ndave.com/wp-content/uploads/2022/12/150471.jpg,1261
6.5″ Wide Abernathy Wall Sconce | 248048,"Refined elegance meets modern distinction with the stunning Abernathy wall sconce. The exquisite Whitestone Idalight diffuser is enhanced with hardware featured in a handsome Nickel powdercoat finish. Handcrafted in the USA, this fixture is offered in custom colors, sizes and patterns, and with dimmable energy efficient LED and standard lamping options. The sconce is UL and cUL listed for dry and damp locations.",https://2ndave.com/product/6-5-wide-abernathy-wall-sconce-248048/,https://2ndave.com/wp-content/uploads/2023/02/248048.jpg,1261
6.5″ Wide Deserto Seco Wall Sconce | 190177,"Captivating and textured like the dry desert sand. This mesmerizing artistic design comes to light with the Deserto Seco wall sconce. An all-over array of stylized accents are represented on Yuma Idalight. The fixture is complemented with a Statuario Idalight diffuser on top and bottom. The impressive shade is complemented with Brass powder coated hardware. Handcrafted in our 180,000 manufacturing facility in Yorkville, New York. Available in custom sizes, finishes and styles. Dimmable energy efficient lamping options offered. UL and cUL listed for dry and damp locations.",https://2ndave.com/product/6-5-wide-deserto-seco-wall-sconce-190177/,https://2ndave.com/wp-content/uploads/2022/12/190177.jpg,1261
6.5″ Wide Deserto Seco Wall Sconce | 204738,"Captivating and textured like the dry desert sand. This mesmerizing artistic design comes to light with the Deserto Seco wall sconce. An all-over array of stylized accents is represented on an Ambra Siena Idalight diffuser. The impressive lens is complemented with Exterior Oil Rubbed Bronze finished hardware. Handcrafted by highly skilled artisans in our 180,000 manufacturing facility in Yorkville, New York. Available in custom sizes, finishes and styles. Dimmable energy efficient lamping options offered. UL and cUL listed for dry and damp locations.",https://2ndave.com/product/6-5-wide-deserto-seco-wall-sconce-204738/,https://2ndave.com/wp-content/uploads/2022/12/204738.jpg,1261
6.5″ Wide Estructura Wall Sconce | 186640,"An architecturally styled fixture engineered and built with a bold look. Give your decor an extra edge with this riveting fixture which is highlighted with a solid metal structure that surrounds Whitestone Idalight panels. The detailed hardware, accents and frame are featured in a Pewter finish. Handcrafted in our 180,000 square foot manufacturing facility in Yorkville, New York. Diffuser styles, metal finishes and fixture sizes can be customized to your needs. UL & cUL listed for dry and damp locations.",https://2ndave.com/product/6-5-wide-estructura-wall-sconce-186640/,https://2ndave.com/wp-content/uploads/2022/12/186640.jpg,1261
6.5″ Wide Personalized Estructura Wall Sconce | 190823,"An architecturally styled fixture engineered and built with a bold look. Give your decor an extra edge with this riveting fixture, which is highlighted with a solid metal structure that surrounds Whitestone Idalight panels. The detailed hardware, accents and frame are featured in a Pewter finish. This interior/exterior wall sconce features 29 as the personalized street address. Handcrafted by highly skilled in our 180,000 square foot manufacturing facility in Yorkville, New York. Diffuser styles, metal finishes and fixture sizes can be customized to your needs. UL and cUL listed for dry, damp and wet locations.",https://2ndave.com/product/6-5-wide-personalized-estructura-wall-sconce-190823/,https://2ndave.com/wp-content/uploads/2022/12/190823.jpg,1261
6.5″W Cilindro Burlap 2 Tier Mini Pendant | 143132,"This unique lighting design features Burlap Textrene on Idalight, which encompasses an inner cylindrical Statuario Idalight diffuser. The fixture is custom crafted by our artisans in Upstate New York in the USA. This pendant is available in custom colors, sizes, styles and energy efficient lamping. The fixture is UL and cUL listed for damp and dry locations.",https://2ndave.com/product/6-5w-cilindro-burlap-2-tier-mini-pendant-143132/,https://2ndave.com/wp-content/uploads/2022/12/143132.jpg,1261
6.5″W Cilindro Mini Pendant | 125591,"Designed with a sleek cylindrical profile that fits into residential and commercial locations, this ceiling fixture defines a distinctive sophisticated aesthetic. The pendant features an Eggshell Textrene shade with a Statuario Idalight bottom. Diffuser. The shade is embraced by architectural styled hardware in an Oil Rubbed Bronze finish. Align this mini pendant in multiples across an island or bar for a powerful design statement. Handcrafted in the USA, this fixture is available in custom colors, styles and sizes, as well as dimmable energy efficient lamping options such as LED. The pendant is UL and cUL listed for damp and dry locations.",https://2ndave.com/product/6-5w-cilindro-mini-pendant-125591/,https://2ndave.com/wp-content/uploads/2022/12/125591.jpg,1261
6.5″W Coolidge Lantern Wall Sconce | 117462,"Created like an eye-catching showcase, the Seeded Glass Panels of the Coolidge Lantern reveal a single Customer supplied, Medium base lamp. The handsome ceiling pendant is enhanced with a rich looking Antique Rust finished frame, base and hardware that reflects a noble, refined look. Individually crafted by the hands of master artisans in Yorkville, NY this luminaire can be customized to your size, color or design requirements. Dimmable energy efficient lamping options are available. The sconce is UL and cUL listed for dry, damp and wet locations.",https://2ndave.com/product/6-5w-coolidge-lantern-wall-sconce-117462/,https://2ndave.com/wp-content/uploads/2022/12/117462.jpg,1261
6.5″W Estructura Wall Sconce | 188535,"An architecturally styled fixture engineered and built with a bold look. Give your decor an extra edge with this riveting fixture, which is highlighted with a solid metal structure that surrounds Whitestone Idalight panels. The detailed hardware, accents and frame are featured in a Nickel powdercoat finish. Handcrafted by skilled artisans in the USA, this captivating wall luminaire is available in custom sizes, designs and colors. Dimmable energy efficient lamping options such as LED are available. The 16-inch tall sconce is UL and cUL listed for dry and damp locations.",https://2ndave.com/product/6-5w-estructura-wall-sconce-188535/,https://2ndave.com/wp-content/uploads/2022/12/188535.jpg,1261
6.5″W IL Bacco Wall Sconce | 117039,"Impeccable interior decor fashion comes to light. A melange of warm colors of Sahara Taupe Idalight and textured designs are revealed with bands of Ambra Siena Idalight. This custom wall sconce, nearly 24 inches in height, is created by the hands of skilled artisans at its manufacturing facility in Upstate New York in the USA. Custom sizes, styles and colors are available, as well as dimmable, energy efficient lamping options such as LED. The curved wall fixture is UL and cUL listed for damp and dry locations.",https://2ndave.com/product/6-5w-il-bacco-wall-sconce-117039/,https://2ndave.com/wp-content/uploads/2022/12/117039A.jpg,1261
6.5″W Renzo Wall Sconce | 116261,"Rustic minimalism blends with Gothic revivalism. A mellow glow is cast from this single Amber faux candlelight which adorns a bobeche and scroll-like arm embraced with wall plate and hand-forged hardware featured in an authentic an Antique Iron Gate finish. Fixtures are offered with multiple candlelights as well, and in a variety of finishes, styles, sizes and dimmable energy efficient lamping options such as LED. Custom crafted in the USA, this fixture is UL and cUL listed for damp and dry locations.",https://2ndave.com/product/6-5w-renzo-wall-sconce-116261/,https://2ndave.com/wp-content/uploads/2022/12/116261.jpg,1261
6.5″W Renzo Wall Sconce | 151198,no description available.,https://2ndave.com/product/6-5w-renzo-wall-sconce-151198/,https://2ndave.com/wp-content/uploads/2022/12/151198.jpg,1261
6.5″W Renzo Wall Sconce | 155248,"Rustic minimalism blends with gothic revivalism. A mellow glow is cast from this single Amber faux candlelight which adorns a scroll-like wall plate and hardware featured in an authentic an Antique Iron Gate finish. Our lighting fixtures are offered with multiple candlelights as well, and in a variety of finishes, styles and energy efficient lamping options. Custom crafted by highly skilled artisans in our 180,000 square foot manufacturing facility in Yorkville, New York.",https://2ndave.com/product/6-5w-renzo-wall-sconce-155248/,https://2ndave.com/wp-content/uploads/2022/12/155248.jpg,1261
6.5″W Sabia Wall Sconce | 116405,"Blending a distinctive style with a rich handsome look, this unique wall sconce reveals a tapered conical diffuser featuring Statuario Idalight and a decorative backplate with a diametric scrolled design in an Antique Iron Gate finish.This sconce, which delivers beautiful ambient lighting, is perfect for corridors in fine homes and hotels, and in other rooms in residential and commercial spaces. Custom crafted in the USA, Sabia is available in custom sizes, designs and colors, and with dimmable energy efficient lamping options.The fixture is UL and cUL listed for dry and damp locations.",https://2ndave.com/product/6-5w-sabia-wall-sconce-116405/,https://2ndave.com/wp-content/uploads/2022/12/116405.jpg,1261
6.5″W Sunburst Wall Sconce | 147595,no description available.,https://2ndave.com/product/6-5w-sunburst-wall-sconce-147595/,https://2ndave.com/wp-content/uploads/2022/12/147595.jpg,1261
6″ Square Charisma Textrene Mini Pendant | 143260,"Beige Textrene edge with a Bronze trim highlights the elegant shade of this Charisma pendant enhanced with a Statuario Idalight bottom diffuser. The shade is complemented with a Timeless Bronze finish. The overall height ranges from 14.5 to 185.5 inches, as the suspension stem length can be adjusted in the factory to accommodate your specific lighting application needs. The Charisma Textrene Pendant is included in our American-made, American-designed, handcrafted Transitional Collection and manufactured in Yorkville, New York. UL and cUL listed for dry and damp locations; however, we do not recommend installing it in spaces that experience a large amount of moisture due to the Textrene shade.",https://2ndave.com/product/6-square-charisma-textrene-mini-pendant-143260/,https://2ndave.com/wp-content/uploads/2022/12/143260.jpg,1261
6″ Square Cranz Lantern Mini Pendant | 235795,The material is Brass and Glass. The finish is Craftsman Brown. The glass is Clear Seeded.,https://2ndave.com/product/6-square-cranz-lantern-mini-pendant-235795/,https://2ndave.com/wp-content/uploads/2022/12/235795.jpg,1261
6″ Square Duvall Shade | 231660,The material is Steel and Glass. The finish is Brushed Stainless Steel. The glass is White Flash.,https://2ndave.com/product/6-square-duvall-shade-231660/,https://2ndave.com/wp-content/uploads/2023/03/231660.jpg,1261
6″ Wide Amada Wall Sconce | 163133,"Designed as a dramatic accent for any room or corridor. This decorative wall sconce features a Faux Leather shade perched on an Amber faux candlelight and bobeche with telescopic styled accents. This handsome fixture offers decorative hardware in a Mahogany Bronze finish. The Amada Wall Sconce is featured in our American manufactured, American designed Traditional Lighting Collection. Manufactured in Yorkville, NY. UL and cUL listed for dry and damp locations however we do not recommend installing it in spaces that experience a large amount of moisture due to the fabric shade.",https://2ndave.com/product/6-wide-amada-wall-sconce-163133/,https://2ndave.com/wp-content/uploads/2022/12/163133.jpg,1261
6″ Wide Ashville Wall Sconce | 128042,"This stunning fixture with a chic curved design features an Art Deco motif. The Cream Textrene diffuser is complemented with a Gilded Tobacco finish. This ADA Compliant wall sconce is handcrafted by highly skilled artisans in our 180,000 square foot manufacturing facility in Yorkville, New York. Shade styles, metal finishes and sconce sizes can be customized. UL and cUL listed for dry and damp locations however we do not recommend installing it in spaces that experience moisture due to the fabric shade.",https://2ndave.com/product/6-wide-ashville-wall-sconce-128042/,https://2ndave.com/wp-content/uploads/2022/12/128042.jpg,1261
6″ Wide Ashville Wall Sconce | 221009,"This stunning fixture with a chic curved design features an Art Deco motif. The Cream Textrene diffuser is complemented with a Gilded Tobacco finish. This ADA Compliant wall sconce is handcrafted by highly skilled artisans in our 180,000 square foot manufacturing facility in Yorkville, New York. Shade styles, metal finishes and sconce sizes can be customized. UL and cUL listed for dry and damp locations however we do not recommend installing it in spaces that experience moisture due to the fabric shade.",https://2ndave.com/product/6-wide-ashville-wall-sconce-221009/,https://2ndave.com/wp-content/uploads/2022/12/221009.jpg,1261
6″ Wide Avenue U Wall Sconce | 244157,"Rendering a stunning architectural look, this structural linear design features a streamlined Clear Glass lens with a Satin Finish. The Ice wall sconce is complemented with Brushed Nickel finished hardware and frame. Custom crafted in Upstate New York at our manufacturing facility, this ADA Compliant fixture is available in custom sizes, styles, colors and lamping options. This 21.5-inch tall fixture is UL and cUL listed for damp and dry locations.",https://2ndave.com/product/6-wide-avenue-u-wall-sconce-244157/,https://2ndave.com/wp-content/uploads/2022/12/244157.jpg,1261
6″ Wide Bechar Pine Cone Wall Sconce | 161021,"A rich, handsome styling greets a distinctive sophisticated look. A Faux Ivory candlelight is perched atop of a custom tailored bobeche accented with a long slender decorative stem embellished with two stunning pinecones and a ball point accent for a high level of aesthetic appeal. A handsome square backplate is complemented with a curved band. Stunning Solid Steel hardware is hand forged and hand finished in a Chestnut hue. Ideal for hallways, foyers and other spaces in homes, restaurants, pubs, hotels and other fine interiors, the fixture is custom crafted by our artisans in our manufacturing facility in Yorkville, New York.Custom sizes, designs, colors and dimmable energy efficient lamping options are available.",https://2ndave.com/product/6-wide-bechar-pine-cone-wall-sconce-161021/,https://2ndave.com/wp-content/uploads/2022/12/161021.jpg,1261
6″ Wide Bechar Pine Cone Wall Sconce | 164157,no description available.,https://2ndave.com/product/6-wide-bechar-pine-cone-wall-sconce-164157/,https://2ndave.com/wp-content/uploads/2022/12/164157.jpg,1261
6″ Wide Bechar Wall Sconce | 135557,"Handsome styling greets a distinctive sophisticated look. A Clear Frosted Glass Cylinder is perched atop of a custom tailored bobeche accented with a long slender decorative stem embellished with a ball tip for a high level of aesthetic appeal. A handsome square backplate is complemented with a curved band. Stunning solid hardware is hand forged and hand finished in a Coffee  Bean. Ideal for hallways, foyers and other spaces in homes, restaurants, pubs, hotels and other fine interiors. The fixture is custom crafted by artisans in our 180,000 square foot manufacturing facility in Yorkville, New York. UL & cUL listed for dry and damp locations.",https://2ndave.com/product/6-wide-bechar-wall-sconce-135557/,https://2ndave.com/wp-content/uploads/2022/12/135557.jpg,1261
6″ Wide Bechar Wall Sconce | 138131,"Handsome styling greets a distinctive sophisticated look. Bechar features a Tawnyrock Idalight Cylinder which is perched atop of a custom tailored bobeche accented with a long slender decorative stem embellished with a ball tip for a high level of aesthetic appeal. A handsome square backplate is complemented with a curved band. Stunning solid hardware is hand forged in a Chestnut finish. Ideal for hallways, foyers and other spaces in homes, restaurants, pubs, hotels and other fine interiors. The fixture is custom crafted by artisans in our 180,000 square foot manufacturing facility in Yorkville, New York. UL & cUL listed for dry and damp locations.",https://2ndave.com/product/6-wide-bechar-wall-sconce-138131/,https://2ndave.com/wp-content/uploads/2022/12/138131.jpg,1261
6″ Wide Bechar Wall Sconce | 145831,"Invite handsome styling that greets a distinctive sophisticated look with the Bechar wall sconce. A Stone Cylindre is perched atop of a custom tailored bobeche accented with a long slender decorative stem embellished with a ball tip for a high level of aesthetic appeal. A handsome square backplate is complemented with a curved band. The wall fixture is Hand Forged and Hand Finished in Gilded Tobacco. Ideal for homes, restaurants, pubs, hotels and other fine interiors. The fixture is custom crafted by artisans in our 180,000 square foot manufacturing facility in Yorkville, New York. Metal finishes and lens colors can be customized to meet your specifications. UL & cUL listed for dry and damp locations.",https://2ndave.com/product/6-wide-bechar-wall-sconce-145831/,https://2ndave.com/wp-content/uploads/2022/12/145831.jpg,1261
6″ Wide Bechar Wall Sconce | 154638,"Handsome styling greets a distinctive sophisticated look. An Ivory faux candlelight is perched atop of a custom tailored bobeche accented with a long slender decorative stem embellished with a ball tip for a high level of aesthetic appeal. A handsome square backplate is complemented with a curved band. Stunning solid hardware is hand forged and hand finished in an Gilded Tobacco hue. Ideal for hallways, foyers and other spaces in homes, restaurants, pubs, hotels and other fine interiors. The fixture is custom crafted by artisans in our 180,000 square foot manufacturing facility in Yorkville, New York. UL & cUL listed for dry and damp locations.",https://2ndave.com/product/6-wide-bechar-wall-sconce-154638/,https://2ndave.com/wp-content/uploads/2022/12/154638.jpg,1261
6″ Wide Bechar Wall Sconce | 171231,"Rich, handsome styling greets a distinctive sophisticated look. A Frosted Glass Cylindre is perched atop of a custom-tailored bobeche. This Bechar wall sconce is accented with a long slender decorative stem embellished with a ballpoint accent for a high level of aesthetic appeal. A handsome round backplate is complemented with stunning hardware hand finished in a Wrought Iron powder coat. Ideal for hallways, foyers and other spaces in homes, restaurants, pubs, hotels and other fine interiors. Custom crafted by artisans in our 180,000 square foot manufacturing facility in Yorkville, New York. Custom sizes, designs, colors available. Dimmable energy efficient lamping options offered. UL and cUL listed for dry and damp locations.",https://2ndave.com/product/6-wide-bechar-wall-sconce-171231/,https://2ndave.com/wp-content/uploads/2022/12/171231.jpg,1261
