name,description,link_url,image_url,manufacturer_id
54″ Wide Beartooth 6 Light Chandelier | 145571,"Integrating an elegant style with a classic distinguished look. The chandelier is custom crafted with six Ambra Siena Idalight Cylindres with Beartooth-like metal accents. The fixture is enhanced with a rugged curved frame in a Wrought Iron finish. Handcrafted in our 180,000 square foot manufacturing facility in Yorkville, NY. Fixture designs, metal finishes and chandelier sizes can be customized to meet your needs. UL and cUL listed for damp and dry locations.",https://2ndave.com/product/54-wide-beartooth-6-light-chandelier-145571/,https://2ndave.com/wp-content/uploads/2022/12/145571.jpg,1261
54″ Wide Beer:30 Pendant | 140177,"Custom designed as decorative fixtures (6 of them) illuminated from a pre-existing recessed light source, this Multiple Beer Bottle Chandelier was crafted for Stone Brewing’s decor to complement general lighting in the space. The customer supplied the wine bottles that were used to build the fixture. We can build custom fixtures inspired by this design with beer bottles and various lighting sources, including LEDs. The Beer Pendant is included in our American-made, American-designed, handmade Wine Bottle Collection and manufactured in Yorkville, NY. UL & cUL listed for dry and damp locations. Contact the factory for more info. Featured in Stone Brewing World Bistro & Gardens, San Diego, CA.",https://2ndave.com/product/54-wide-beer30-pendant-140177/,https://2ndave.com/wp-content/uploads/2022/12/140177.jpg,1261
54″ Wide Bird’s Nest Semi-Flushmount | 182520,"Inspired by the engineering genius of the natural aviators of our world. This elaborate ceiling fixture looks like a bird’s nest with a branch-like style that is hand finished in Oil Rubbed Bronze. This pendant offers a peekaboo view of eight Edison style lamps for beautiful ambient illumination. Ideal for illuminating dining rooms and other spaces in residential, hospitality and commercial areas. Handcrafted in our 180,000 square foot manufacturing facility in Yorkville, New York. Diffuser colors, metal finishes and fixture sizes can be customized to your needs. UL and cUL listed for dry and damp locations.",https://2ndave.com/product/54-wide-birds-nest-semi-flushmount-182520/,https://2ndave.com/wp-content/uploads/2022/12/182520.jpg,1261
54″ Wide Bola 12 Light Two Tier Chandelier | 241019,"Innovation and imagination are integrated for a stunning decorative lighting look. A captivating illuminating design, this cascading chandelier displays 12 Clear Seeded Glass globes. The Bola orbs reveal customer-supplied Edison bulbs attached to hardware featured in a Solar Black finish. The chandelier is perfect for foyers, lobbies, and other spaces with tall ceilings. The Bola Chandelier is featured in our American-made, American-designed, handmade Modern Lighting Collection and manufactured in Yorkville, NY. UL & cUL listed for dry and damp locations.",https://2ndave.com/product/54-wide-bola-12-light-two-tier-chandelier-241019/,https://2ndave.com/wp-content/uploads/2023/03/241019.jpg,1261
54″ Wide Christabel Oblong Pendant | 118120,"Enjoy the romance and elegance of this oblong billiard pendant which is adorned with 3 White blown-glass, dome shaped shades, which are embraced by scrolled arms and decorative accents. An abstract floral medallion distinguishes the center of this exquisite lighting design, which is featured in a Cortez Gold finish. Custom crafted in the Yorkville, New York manufacturing facility, this fixture is perfect for illuminating billiard tables, islands, counters and bars. It is offered in custom sizes, colors and styles, as well as dimmable energy efficient lamping options such as LED. This custom pendant is UL and cUL listed for damp and dry locations.",https://2ndave.com/product/54-wide-christabel-oblong-pendant-118120/,https://2ndave.com/wp-content/uploads/2022/12/118120.jpg,1261
54″ Wide Cilindro Circle X Pendant | 228932,"The material is Steel, Textrene, and Idalight. The finish is Timeless Bronze. The diffuser is Eggshell Textrene and Statuario Idalight.",https://2ndave.com/product/54-wide-cilindro-circle-x-pendant-228932/,https://2ndave.com/wp-content/uploads/2022/12/228932.jpg,1261
54″ Wide Dacia Inverted Pendant | 146867,no description available.,https://2ndave.com/product/54-wide-dacia-inverted-pendant-146867/,https://2ndave.com/wp-content/uploads/2022/12/146867.jpg,1261
54″ Wide Espe Flushmount | 234656,"Lilac styled Leaves and Branches in a Tyler Bronze finish appear to grow and flourish around this curvaceous ceiling fixture. The fixture features a stunning Travertine Idalight Lens for beautiful ambient illumination. The Espe Semi-Flushmount is featured in our American made, American designed handcrafted Nature Inspired Lighting Collection. Manufactured in Yorkville, New York. UL and cUL listed for dry and damp locations.",https://2ndave.com/product/54-wide-espe-flushmount-234656/,https://2ndave.com/wp-content/uploads/2022/12/234656.jpg,1261
54″ Wide Estrella 16 Light Two Tier Chandelier | 181462,"Exquisite grace and delicate beauty are blended to create a distinctive, elegant Grand Chandelier. A total of 16 Amber Faux candlelights, each embracing a bobeche and scrolled arm, adorn two tiers of this chandelier. The decorative accents, frame and hand-forged Iron hardware are offered in an alluring Textured Black finish. Perfect for a large entryway, lobby, banquet hall or conference room, this lovely chandelier is available in a variety of finishes, styles and sizes, and with dimmable energy efficient lamping options such as LED. Custom crafted in the USA, Estrella is UL and cUL listed for damp and dry locations.",https://2ndave.com/product/54-wide-estrella-16-light-two-tier-chandelier-181462/,https://2ndave.com/wp-content/uploads/2022/12/181462X10-1.jpg,1261
54″ Wide Felicia 10 Light Chandelier | 120317,"Romantic charm and and sophisticated elegance come to light with the luxurious Felicia chandelier, which features 10 Amber faux candlelights perched on floral bobeches. The fixture is enhanced with scroll designed arms and accented with dazzling Crystal droplets. The Hand-forged Iron hardware, frame and decorative accents are highlighted in a stunning Gilded Tobacco Finish. Handcrafted by highly skilled artisans in our Upstate New York manufacturing facility, this classic styled chandelier is available in custom sizes, styles, colors and energy efficient lamping options such as LED. This lovely, elaborate fixture is UL and cUL listed for dry and damp locations.",https://2ndave.com/product/54-wide-felicia-10-light-chandelier-120317/,https://2ndave.com/wp-content/uploads/2022/12/120317.jpg,1261
54″ Wide Grand Stair 18 Light Chandelier | 212104,"Graceful elegance and a distinctive refinement are reflected in this appealing lighting masterpiece. This chandelier renders an exquisite design featured in a Gilded Tobacco finish and adorned with a multitude of arched accents. The elegant Hand forged iron chandelier renders two tiers. 18 Amber faux candlelights are perched on delicate bobeches and topped with Antique Cream Textrene shades which deliver beautiful ambient light. The overall height of this chandelier ranges from 90 to 269 inches as the chain length can be easily adjusted in the field to accommodate your specific lighting application needs. Custom crafted in our 180,000 square foot manufacturing facility in Yorkville, New York. UL and cUL listed for dry and damp locations.",https://2ndave.com/product/54-wide-grand-stair-18-light-chandelier-212104/,https://2ndave.com/wp-content/uploads/2022/12/212104.jpg,1261
54″ Wide Grand Stair 20 Light Chandelier | 174484,"Graceful elegance and a distinctive refinement are reflected in this appealing lighting masterpiece. This chandelier renders an exquisite design featured in a Spanish Gold finish and adorned with a multitude of arched accents. The chandelier renders two tiers, each with 9 Amber faux candlelights perched on delicate bobeches and topped with Antique Cream Textrene shades which deliver beautiful ambient light. The elegant Hand-Forged Iron fixture features American craftsmanship perfected by years of time honored artistry in our 180,000 square foot manufacturing facility in Yorkville, New York. This chandelier is perfect for illuminating lobbies, dining rooms and other spaces. Custom options available. UL and cUL listed for damp and dry locations.",https://2ndave.com/product/54-wide-grand-stair-20-light-chandelier-174484/,https://2ndave.com/wp-content/uploads/2022/12/174484.jpg,1261
54″ Wide Hampton Inverted Pendant | 185299,"Capture an elegant European style design. Sculpted Acanthus leaves adorn this classic ceiling pendant which is highlighted with a stunning Fleshtone Idalight diffuser. The finial and decorative accents are featured in Rustic Iron. The overall height of this pendant ranges from 40 to 70 inches as the chain length can be easily adjusted in the field to accommodate your specific lighting application needs. Custom crafted in our 180,000 square foot manufacturing facility in Yorkville, NY. Lens colors, metal finishes and sizes can be customized to meet your needs. UL and cUL listed for damp and dry locations.",https://2ndave.com/product/54-wide-hampton-inverted-pendant-185299/,https://2ndave.com/wp-content/uploads/2022/12/185299.jpg,1261
54″ Wide Jupiter 20 Light Chandelier | 156660,no description available.,https://2ndave.com/product/54-wide-jupiter-20-light-chandelier-156660/,https://2ndave.com/wp-content/uploads/2022/12/156660.jpg,1261
54″ Wide Lakeshore 15 Light Two Tier Chandelier | 169258,"Blending an elegant style with a rich luxurious look. The Lakeshore chandelier features two Antique Rust finished rings that provide timeless beauty and overall illumination. A total of 15 Amber faux candle lights are mounted on bobeches on two tiers of this elaborate structure. The overall height ranges from 68 to 135 inches as the chain length can be easily adjusted in the field to accommodate your specific lighting application needs. Custom crafted by highly skilled artisans in our 180,000 square foot manufacturing facility in Yorkville, New York. Custom sizes and finishes available. UL and cUL listed for dry and damp locations.",https://2ndave.com/product/54-wide-lakeshore-15-light-two-tier-chandelier-169258-2/,https://2ndave.com/wp-content/uploads/2022/12/169258.jpg,1261
54″ Wide Lakeshore 21 Light Three Tier Chandelier | 233991,The material is Steel. The finish is Distressed Chestnut.,https://2ndave.com/product/54-wide-lakeshore-21-light-three-tier-chandelier-233991/,https://2ndave.com/wp-content/uploads/2022/12/233991.jpg,1261
54″ Wide Loxley 24 Light Two Tier Chandelier | 197483,"Blending an elegant style with a classic distinguished look, Loxley is custom crafted with 24 Frosted Glass Cylindres on two tiers. This large chandelier is featured in an Oil Rubbed Bronze finish. Ideal for illuminating dining areas, conference tables, lobbies and other residential, hospitality and commercial spaces. Handcrafted by highly skilled artisans in our 180,000 square foot manufacturing facility in Yorkville, New York. Diffuser colors, metal finishes and fixture sizes can be customized to your needs. UL and cUL listed for dry and damp locations.",https://2ndave.com/product/54-wide-loxley-24-light-two-tier-chandelier-197483/,https://2ndave.com/wp-content/uploads/2022/12/197483.jpg,1261
54″ Wide Loxley 24 Light Two Tier Chandelier | 210577,"Blending an elegant style with a classic distinguished look. Loxley is custom crafted with 24 Ambra Siena Idalight Cylindres on two tiers. The chandelier is featured in a Mahogany Bronze finish. Ideal for illuminating dining areas, conference tables, lobbies and other residential, hospitality and commercial spaces. Handcrafted by highly skilled artisans in our 180,000 square foot manufacturing facility in Yorkville, New York. Diffuser colors, metal finishes and fixture sizes can be customized to your needs. UL and cUL listed for dry and damp locations.",https://2ndave.com/product/54-wide-loxley-24-light-two-tier-chandelier-210577/,https://2ndave.com/wp-content/uploads/2022/12/210577.jpg,1261
54″ Wide Loxley 24 Light Two Tier Chandelier | 259406,no description available.,https://2ndave.com/product/54-wide-loxley-24-light-two-tier-chandelier-259406/,https://2ndave.com/wp-content/uploads/2023/03/259406.jpg,1261
54″ Wide Marquee Pendant | 133374,"Add drama and sophistication paired with distinctive lighting and quality. Marquee is a unique pendant featuring fluted Crystal Idalight that is complemented with trim and hardware offered in a Nickel finish. Handmade in the USA, this pendant is offered in custom sizes, styles and finishes, as well as dimmable energy efficient lamping options. UL and cUL listed for damp and dry locations.",https://2ndave.com/product/54-wide-marquee-pendant-133374/,https://2ndave.com/wp-content/uploads/2022/12/133374.jpg,1261
54″ Wide Parnella 10 Light Chandelier | 215483,"Custom crafted for the King or Queen in your castle. Parnella presents a touch of warm opulence blended with handsome styling. This chandelier offers an extraordinary transitional style as sparkling illumination evokes from 10 complementary faux candlelights. The solid ring and finial are enhanced with a Charcoal Gray finish. This fixture will make a design statement as a centerpiece in any room including an entryway, dining room, lobby, conference room and other locations. Handcrafted in our 180,000 square foot manufacturing facility in Yorkville, New York. Available in custom sizes, styles and finishes. UL and cUL listed for dry and damp locations.",https://2ndave.com/product/54-wide-parnella-10-light-chandelier-215483/,https://2ndave.com/wp-content/uploads/2022/12/215483.jpg,1261
54″ Wide Penelope 10 Light Pendant | 178338,"American craftsmanship creates the beauty of fine lighting with the elegant Penelope pendant. A circular frame with a Crystal Idalight lens reveals a faux candelabra with 10 customer-supplied BA9 40-watt lamps. The decorative steel arms, along with diamond and cross designed accents, are hand finished in a handsome Extreme Chrome powdercoat. Custom sizes, designs and colors are available, as well as dimmable energy efficient lamping options such as LED. The fixture is UL and cUL listed for damp and dry locations.",https://2ndave.com/product/54-wide-penelope-10-light-pendant-178338/,https://2ndave.com/wp-content/uploads/2022/12/178338.jpg,1261
54″ Wide Porta 20 Light Two Tier Chandelier | 214838,"Inspired by cruise ship double deck portholes and embellishments with breathtaking oceanic site lines. This Grand Chandelier features two tiers of luminosity. 20 Statuario Idalight Cylindres project beautiful ambient illumination with energy efficient LEDs. The fixture is enhanced with a Charcoal Gray finish. The overall height ranges from 85 to 204 inches as the chain length can be easily adjusted in the field to accommodate your specific lighting application needs. Lens colors, metal finishes and fixture sizes can be customized to your needs. Custom crafted by highly skilled artisans in our 180,000 square foot manufacturing facility in Yorkville, New York. UL and cUL listed for dry and damp locations.",https://2ndave.com/product/54-wide-porta-20-light-two-tier-chandelier-214838/,https://2ndave.com/wp-content/uploads/2022/12/214838.jpg,1261
54″ Wide Salzburg 18 Light Chandelier | 239854,"A dazzling symphony of light. This opulent chandelier is drenched in luxurious Rock Crystal droplets. 18 Complementary faux candlelights are embraced by matching glass bobeches. The elaborate frame and hardware are finished in a Blackened Pewter Powder Coat. The overall height ranges from 83 to 122 inches as the chain can be easily adjusted in the field. The Salzburg Chandelier is featured in our American made, American designed handcrafted Crystal Lighting Collection. Manufactured in Yorkville, New York. UL and cUL listed for dry and damp locations. Please call for price and availability.",https://2ndave.com/product/54-wide-salzburg-18-light-chandelier-239854/,https://2ndave.com/wp-content/uploads/2022/12/239854.jpg,1261
54″ Wide Serratina Chandelier | 119766,"Unsurpassed elegance, grace and beauty are defined by the Serratina Chandelier. With shapely curves in an exquisite Corinth finish, Serratina offers a lustrous symphony of Hand-Forged Iron Scrollwork, accented with metal Acanthus Leaves throughout. 24 Delicate faux candlelights crowned with Diamond-cut Crystal Hurricane Shades project beautiful ambient illumination. The luxurious chandelier will add sophisticated sparkle and romantic charm to any room. Handcrafted by skilled artisans in our 180,000 square foot manufacturing facility in Yorkville, NY. The number of lights, metal finishes and fixture sizes can be customized to your needs. UL and cUL listed for dry and damp locations.",https://2ndave.com/product/54-wide-serratina-chandelier-119766/,https://2ndave.com/wp-content/uploads/2022/12/119766.jpg,1261
54″ Wide Serratina Crystal Chandelier | 119767,"The Serratina Chandelier defines unsurpassed elegance, grace and glamorous beauty. With shapely curved arms in an exquisite Gilded Tobacco finish, a lustrous symphony of Hand-Forged Iron Scrollwork, Hand-Cut Crystal Pendalogs and Acanthus Leaf accents complement 24 delicate Amber faux candlelights revealed by Clear Faceted Hurricane Glass Shades creating beautiful ambient illumination. The luxurious chandelier will add sophisticated sparkle and romantic charm to any room. Handcrafted in the USA, a myriad of custom options include the sizes, styles, finishes and dimmable energy efficient lamping options of your choice. The Grandiose 54-inch wide chandelier is UL and cUL listed for damp and dry locations.",https://2ndave.com/product/54-wide-serratina-crystal-chandelier-119767/,https://2ndave.com/wp-content/uploads/2022/12/119767.jpg,1261
54″ Wide Silverton Chandelier | 198973,The material is Steel and Idalight. The finish is Rusty Nail and Vintage Copper. The shade has Sahara Taupe and Fleshtone Idalight.,https://2ndave.com/product/54-wide-silverton-chandelier-198973/,https://2ndave.com/wp-content/uploads/2022/12/198973.jpg,1261
54″ Wide St Lawrence 21 Light Chandelier | 214042,"Feel the wind in your hair, the sound of the sea beneath you and imagine the stars above after launching this breathtaking vessel of light. The St Lawrence chandelier is like a tall ship traditionally rigged with masts drawn tight by backstays. The 3 tiers and 21 Sandstorm Faux Linen handpainted shades and Oil Rubbed Bronze frame symbolize the schooner’s multiple masts, vast sails and narrow hulls. Overall height ranges from 55 to 162 inches as the chain length can be easily adjusted in the field to accommodate your specific needs. Handcrafted in our 180,000 square manufacturing facility in Yorkville, New York. Shade styles, metal finishes and fixtures sizes can be customized to meet your needs. UL and cUL listed for dry and damp locations.",https://2ndave.com/product/54-wide-st-lawrence-21-light-chandelier-214042/,https://2ndave.com/wp-content/uploads/2022/12/214042.jpg,1261
54″ Wide St Lawrence 21 Light LED Chandelier | 152191,"Feel the wind in your hair, the sound of the sea beneath you and imagine the stars above after launching this breathtaking sea vessel. The St Lawrence chandelier is a tall ship traditionally rigged with masts drawn tight by backstays. The three tiers and 21 Sandstorm faux linen painted shades with furled ends and Oil Rubbed Bronze frame symbolize the schooner’s multiple masts, vast sails and narrow hulls. The fixture is powered with energy efficient LEDs for energy savings, high quality light, low maintenance and long life. Handcrafted in our 180,000 square foot manufacturing facility in Yorkville, New York. UL and cUL listed for dry and damp locations.",https://2ndave.com/product/54-wide-st-lawrence-21-light-led-chandelier-152191/,https://2ndave.com/wp-content/uploads/2022/12/152191.jpg,1261
54″ Wide Valhalla 3 Light Chandelier | 117418,"A Grand styled chandelier that incorporates a unique Gothic design and beckons with light.Valhalla features 3 decorative lanterns that reveal Ambra Siena Idalight which are complemented with hardware in a Blackwash finish. The impressive decorative ring and shade frames, shown in a matching finish, are embellished with decorative accents and shield medallions. Handcrafted in the USA by highly skilled artisans in Upstate New York, this striking fixture is offered in custom styles, colors and sizes are available. Energy efficient lamping options such as LED are available. The 54-inch wide chandelier is UL and cUL listed for damp and dry locations.",https://2ndave.com/product/54-wide-valhalla-3-light-chandelier-117418/,https://2ndave.com/wp-content/uploads/2022/12/117418.jpg,1261
54″ Wide Venetian Fireplace Screen | 122474,"An elegant design defines this decorative firescreen. Hand Forged Iron Scrollwork with Leaves are featured in a delicately hand-applied Rust finish. Custom crafted by highly skilled artisans in our 180,000 square foot manufacturing facility in Yorkville, New York. Metal finishes, monogram designs and sizes can be customized to your needs.",https://2ndave.com/product/54-wide-venetian-fireplace-screen-122474/,https://2ndave.com/wp-content/uploads/2022/12/122474.jpg,1261
54″ Wide Willowbend Exes Pendant | 196825,"Designed in a unique crisscross styled pattern with four stunning orbs. The massive Willowbend Pendant features Black Textured powder coated frame and hardware.Four Statuario Idalight orbs deliver beautiful ambient illumination and are embraced by a central conduit. Handcrafted in our 180,000 square manufacturing facility in Yorkville, NY. The pendant is offered with custom sizes and finishes. Dimmable energy efficient lamping options offered. UL and cUL listed for damp and dry locations.",https://2ndave.com/product/54-wide-willowbend-exes-pendant-196825/,https://2ndave.com/wp-content/uploads/2022/12/196825.jpg,1261
54″L Laramie 8 LT Pot Rack | 188402,"A handsome chandelier that doubles a lighted pot rack. Laramie features a sturdy frame with a stunning Blackened Pewter finish. 8 Ivory faux candlelights are crowned with Alabaster Textrene Shades supported by bobeches while providing ambient illumination. Designed with hooks to display fine cookware in a culinary space. Overall height ranges from 41 to 93 inches as the chain length can be easily adjusted in the field. Handcrafted in our 180,000 sq ft manufacturing facility in Yorkville, NY. Shade colors, metal finishes and fixture sizes can be customized to your needs. UL and cUL listed for dry and damp locations however we do not recommend installing it in spaces that experience a large amount of moisture due to the fabric shades. (Cookware not included)",https://2ndave.com/product/54l-laramie-8-lt-pot-rack-188402/,https://2ndave.com/wp-content/uploads/2022/12/188402.jpg,1261
54″L Meyer BBQ Oblong Pendant | 135220,no description available.,https://2ndave.com/product/54l-meyer-bbq-oblong-pendant-135220/,https://2ndave.com/wp-content/uploads/2022/12/135220.jpg,1261
54″L Nelson Oblong Pendant | 170994,"Rendering a stunning architectural look, this structural linear design features a streamlined Clear Seeded Glass lens that reveals a Frosted Seeded Glass diffuser. The oblong fixture, which is ideal for illuminating conference tables, islands and counters, is complemented with Clear Matte Steel finished hardware. Custom crafted by highly skilled artisans in our 180,000 square foot manufacturing facility in Yorkville, New York, this fixture is available in custom sizes, styles, colors and lamping options. This pendant is UL and cUL listed for damp and dry locations.",https://2ndave.com/product/54l-nelson-oblong-pendant-170994-2/,https://2ndave.com/wp-content/uploads/2022/12/170994.jpg,1261
54″L Quadrato Lange Oblong Pendant | 128288,"Rendering an appealing architectural look, this structural linear design features Clear Seeded Glass that encases a Tawnyrock Idalight diffuser with a frame offered in a Polished Chrome finish. Custom crafted in Upstate New York at our manufacturing facility, the Quadrato Lange 54-inch fixture is available in custom sizes, styles, colors and dimmable lamping options such as LED. This fixture is UL and cUL listed for dry and damp locations.",https://2ndave.com/product/54l-quadrato-lange-oblong-pendant-128288/,https://2ndave.com/wp-content/uploads/2022/12/128288.jpg,1261
54″L Revival Chic 17 LT Cascading Pendant | 151910,"Industrial utilitarian mult-light pendants are offered with a modern flair. Steel and Brass diffusers are offered with hardware finished in a Solar Black powdercot, Timeless Bronze and Antique Brass. Custom crafted in the USA, this fixture is available with custom designs, colors, and sizes, as well as dimmable energy efficient lamping options such as LED. The 54-inch wide fixture is UL and cUL listed for damp and dry locations.",https://2ndave.com/product/54l-revival-chic-17-lt-cascading-pendant-151910/,https://2ndave.com/wp-content/uploads/2022/12/151910.jpg,1261
